tests/v2/performance/kernels/cuda/gemm/fixtures/cuda_prefill_dispatch_alias_smoke.csv
format,codebook,shape,m,n,k,tile,tile_id,strategy,split_k,tiles,min_us,mean_us,tops,pct_peak,gpu
Q4_1,5,alias_q4_1,64,512,2048,T64x128_w2x2,1,STD,1,4,20.0,21.0,3.36,50.0,0
Q4_K,5,alias_q4_k,64,2048,512,T64x128_w4x2,2,STD,1,16,18.0,19.0,3.73,51.0,0
Q5_1,7,alias_q5_1,64,512,2048,T64x128_w2x2,1,STD,1,4,21.0,22.0,3.20,47.0,0
Q5_K,7,alias_q5_k,64,2048,512,T64x128_w4x2,2,STD,1,16,19.0,20.0,3.53,48.0,0
IQ4_NL,4,alias_iq4_nl,64,512,2048,T64x128_w2x2,1,STD,1,4,20.5,21.5,3.27,49.0,0
IQ4_XS,4,alias_iq4_xs,64,2048,512,T64x128_w4x2,2,STD,1,16,18.5,19.5,3.63,50.5,0
